name,japanese_name,romanized_name,meaning,type,user,previous_users,abilities,description,image_url,url
Gomu Gomu no Mi,,Gomu Gomu no Mi,,Paramecia,,,,The Gomu Gomu no Mi is a Paramecia-type Devil Fruit.,,https://onepiece.fandom.com/wiki/Gomu_Gomu_no_Mi
Bara Bara no Mi,バラバラの実,Bara Bara no Mi,Scattered; in pieces,Paramecia,Buggy,,,"The Bara Bara no Mi is a Paramecia-type Devil Fruit that allows the user to split their own body into pieces and levitate said pieces at will, while granting a passive immunity to all slashes and cuts, making the user a Splitting Human (バラバラ人間, Barabara Ningen?, English: ""Chop-Chop Man/Person""). It was eaten (accidentally) by Buggy.",https://static.wikia.nocookie.net/onepiece/images/9/9c/Bara_Bara_no_Mi_Infobox.png/revision/latest?cb=20240421082610,https://onepiece.fandom.com/wiki/Bara_Bara_no_Mi
Sube Sube no Mi,スベスベの実,Sube Sube no Mi,Smooth,Paramecia,Alvida,,,"The Sube Sube no Mi is a Paramecia-type Devil Fruit that makes the user's body smooth and slippery, which in turn makes most attacks and objects slide off their body, protecting the user from harm in most situations. As seen with Alvida, if one is overweight in any way they will become slim by having the excess fat ""slip off"". It was eaten by Alvida.",https://static.wikia.nocookie.net/onepiece/images/e/e9/Sube_Sube_no_Mi_Infobox.png/revision/latest?cb=20250826143841,https://onepiece.fandom.com/wiki/Sube_Sube_no_Mi
Bomu Bomu no Mi,ボムボムの実,Bomu Bomu no Mi,Bomb,Paramecia,Gem,Ganzui,,"The Bomu Bomu no Mi is a Paramecia-type Devil Fruit that allows the user to make any part of their body explode, whether it be their limbs, hair, mucus, even breath or cough, making the user a Bomb Human (爆弾人間, Bakudan Ningen?, VIZ: ""Human Dynamite"", Funimation: ""Bomb Man""). It was eaten by Ganzui, and sometime after its reincarnation it was eaten by Gem, better known by his Baroque Works alias Mr. 5.",https://static.wikia.nocookie.net/onepiece/images/1/1a/Bomu_Bomu_no_Mi_Infobox.png/revision/latest?cb=20210204030003,https://onepiece.fandom.com/wiki/Bomu_Bomu_no_Mi
Kilo Kilo no Mi,,Kilo Kilo no Mi,,Paramecia,,,,The Kilo Kilo no Mi is a Paramecia-type Devil Fruit.,,https://onepiece.fandom.com/wiki/Kilo_Kilo_no_Mi
